<page
	xmlns="http://www.rustleund.com/fighting-fantasy/page"
	xmlns:xsi="http://www.w3.org/2001/XMLSchema-instance" 
	xsi:schemaLocation="http://www.rustleund.com/fighting-fantasy/page ../../page.xsd">
	<pagetext>
		<html>
		</html>
	</pagetext>
	<immediate>
		<testFlag id="3">
			<successful>
				<displayText id="0" />
			</successful>
			<unsuccessful>
				<displayText id="1" />
			</unsuccessful>
		</testFlag>
	</immediate>
	<multicommand id="0">
		<testSkill diceRollAdjustment="2">
			<successful>
				<displayText id="2" />
				<setFlag id="5" />
			</successful>
			<unsuccessful>
				<displayText id="3" />
			</unsuccessful>
		</testSkill>
	</multicommand>
	<text id="0">
		<p>
			<a href="http://domulti:0"><i>Test your Skill</i></a> (adding 2).
		</p>
	</text>
	<text id="1">
		<p>
			You easily escape, click <a href="http://link:387">here</a>.
		</p>
	</text>
	<text id="2">
		<p>
			You evade them and jump down into the back streets, where you evade their pursuit.
			But now you're going to be hunted by the militia, which will make your quest
			very difficult in the future. Click <a href="http://link:387">here</a> to continue.
		</p>
	</text>
	<text id="3">
		<p>
			You are caught by the guards. Click <a href="http://link:143">here</a> to continue.
		</p>
	</text>
</page>