<page
	xmlns="http://www.rustleund.com/fighting-fantasy/page"
	xmlns:xsi="http://www.w3.org/2001/XMLSchema-instance" 
	xsi:schemaLocation="http://www.rustleund.com/fighting-fantasy/page https://github.com/arustleund/fighting-fantasy/raw/master/docs/page.xsd">
	<pagetext>
		<html>
			<p>
				The militia are very suspicious indeed, although they clearly know the grey-robed 
				men to be evil people. They cart you off to jail and keep you there for
				some time.
			</p>
		</html>
	</pagetext>
	<immediate>
		<setFlag id="0" />
		<testFlag id="4">
			<successful>
				<displayText id="0" />
				<adjustScale type="time" amount="10" />
			</successful>
			<unsuccessful>
				<displayText id="1" />
				<adjustScale type="time" amount="4" />
			</unsuccessful>
		</testFlag>
	</immediate>
	<text id="0">
		<p>
			Because you tried to escape through the window of the tavern room,
			they hold you for five days (add 10 to your Time Track).
			Then they turf you out.
			Click <a href="http://link:387">here</a> to continue.
		</p>
	</text>
	<text id="1">
		<p>
			Because you didn't try to escape through the window of the tavern room,
			they hold you for two days (add 4 to your Time Track).
			Then they turf you out.
			Click <a href="http://link:387">here</a> to continue.
		</p>
	</text>
</page>